{"command_status":{"connector_list":{"collected_at":"2026-09-08T14:57:55Z","duration_ms":0,"error":null,"last_success_at":"2026-09-08T14:57:55Z","status":"healthy"},"node_info":{"collected_at":"2026-09-08T14:57:55Z","duration_ms":0,"error":null,"last_success_at":"2026-09-08T14:57:55Z","status":"healthy"},"peer_list":{"collected_at":"2026-09-08T14:57:55Z","duration_ms":0,"error":null,"last_success_at":"2026-09-08T14:57:55Z","status":"healthy"},"route_list":{"collected_at":"2026-09-08T14:57:55Z","duration_ms":0,"error":null,"last_success_at":"2026-09-08T14:57:55Z","status":"healthy"},"stats_show":{"collected_at":"2026-09-08T14:57:55Z","duration_ms":0,"error":null,"last_success_at":"2026-09-08T14:57:55Z","status":"healthy"}},"connectors":{"items":[{"address_family":"unknown","endpoint":"bootstrap.example:11010","port":11010,"raw_status":0,"status":"connected","transport":"udp","url":"udp://bootstrap.example:11010"}],"tcp_active":false,"tcp_configured":false,"tcp_listener_available":null,"total":1},"error":null,"node":{"administrative_role":null,"hostname":"fixture-node","inst_id":"fixture-instance","instance_name":"fixture-node","listeners":["udp://[::]:11010"],"network_name":"home","overlay_ipv4":"10.250.250.1","peer_id":"12345","proxy_cidrs":["192.168.68.0/24"],"schema_compatibility":"supported","state":"running","stun_info":{"last_update_time":"2026-08-23T12:00:00Z","public_ips":["203.0.113.10"],"tcp_nat_type":"Unknown","udp_nat_type":"OpenInternet"},"version":"2.6.4-8428a89d"},"peers":{"direct":1,"ipv6_udp_direct":null,"items":[{"address_family":"ipv6","closed":false,"cost":"p2p","established_tunnels":["tcp6","udp"],"hostname":"remote","latency_ms":10.09,"locally_initiated":false,"loss_rate":0.0,"nat_type":"Cone","overlay_ipv4":"10.250.250.2","path_state":"direct","peer_id":"54321","rx_bytes":0,"rx_display":"814.06 kB","rx_packets":0,"transport":"unknown","tx_bytes":0,"tx_display":"6.97 MB","tx_packets":0,"version":"2.6.4"}],"relay":0,"total":1,"unknown_path":0},"routes":{"items":[{"cost":0,"hostname":"fixture-node","is_local":true,"next_hop_peer_id":"Local","overlay_ipv4":"10.250.250.1","path_latency_ms":0.0,"path_state":"unknown","peer_id":null,"proxy_cidrs":["192.168.68.0/24"],"version":"2.6.4"},{"cost":1,"hostname":"remote","is_local":false,"next_hop_peer_id":"remote","overlay_ipv4":"10.250.250.2","path_latency_ms":10.0,"path_state":"unknown","peer_id":null,"proxy_cidrs":["192.168.88.0/24"],"version":"2.6.4"}],"total":2},"source":"easytier_cli","stale":false,"status":"healthy","traffic":{"by_instance":[{"bytes_rx":31,"bytes_tx":null,"from_instance_id":"remote","network_name":"home","packets_rx":3,"packets_tx":null,"to_instance_id":null},{"bytes_rx":null,"bytes_tx":41,"from_instance_id":null,"network_name":"home","packets_rx":null,"packets_tx":4,"to_instance_id":"remote"}],"bytes_forwarded":303,"bytes_rx":101,"bytes_tx":202,"packets_rx":11,"packets_tx":12,"rx_bps":null,"samples":[{"labels":{"network_name":"home"},"name":"traffic_bytes_rx","value":101},{"labels":{"network_name":"home"},"name":"traffic_bytes_tx","value":202},{"labels":{"network_name":"home"},"name":"traffic_bytes_forwarded","value":303},{"labels":{"network_name":"home"},"name":"traffic_packets_rx","value":11},{"labels":{"network_name":"home"},"name":"traffic_packets_tx","value":12},{"labels":{"from_instance_id":"remote","network_name":"home"},"name":"traffic_bytes_rx_by_instance","value":31},{"labels":{"network_name":"home","to_instance_id":"remote"},"name":"traffic_bytes_tx_by_instance","value":41},{"labels":{"from_instance_id":"remote","network_name":"home"},"name":"traffic_packets_rx_by_instance","value":3},{"labels":{"network_name":"home","to_instance_id":"remote"},"name":"traffic_packets_tx_by_instance","value":4},{"labels":{"method_name":"first","network_name":"home"},"name":"peer_rpc_client_rx","value":1},{"labels":{"method_name":"second","network_name":"home"},"name":"peer_rpc_client_rx","value":2}],"tx_bps":null},"updated_at":"2026-09-08T14:57:55Z"}
